{
  "description": "Released 0.8.0 warning fixture unresolved-external-tool-example-ref.json.",
  "document": "../../../0.8.0/fixtures/expected-warning/unresolved-external-tool-example-ref.json",
  "expectedPatch": [
    {
      "op": "replace",
      "path": "/mcpdesc",
      "value": "0.9.0"
    },
    {
      "op": "replace",
      "path": "/$schema",
      "value": "https://mcpdesc.org/schema/mcp-description/0.9.0-draft.4.json"
    }
  ],
  "expectedStatus": "converted",
  "from": "0.8.0",
  "to": "0.9.0"
}
