{
  "description": "No conversion is defined from 0.7.0.",
  "document": {
    "info": {
      "name": "legacy",
      "version": "1.0.0"
    },
    "mcpdesc": "0.7.0"
  },
  "expectedDiagnostics": [
    {
      "code": "conversion-path-undefined",
      "path": [],
      "rule": "mcpdesc.conversion.path-defined"
    }
  ],
  "expectedStatus": "unsupported",
  "from": "0.7.0",
  "to": "0.9.0"
}
