{
  "description": "Released 0.8.0 example minimal.yaml.",
  "document": "../../../0.8.0/examples/minimal.yaml",
  "expectedPatch": [
    {
      "op": "replace",
      "path": "/mcpdesc",
      "value": "0.9.0"
    },
    {
      "op": "replace",
      "path": "/$schema",
      "value": "https://mcpdesc.org/schema/mcp-description/0.9.0-draft.2.json"
    }
  ],
  "expectedStatus": "converted",
  "from": "0.8.0",
  "to": "0.9.0"
}
