{
  "description": "Released 0.8.0 valid fixture client-capability-requirements.json. Blocked by closed MCP types.",
  "document": "../../../0.8.0/fixtures/expected-valid/client-capability-requirements.json",
  "expectedDiagnostics": [
    {
      "code": "conversion-blocked",
      "path": [
        "prompts",
        0,
        "clientRequirements",
        "futureCapability"
      ],
      "rule": "mcpdesc.conversion.0-8-to-0-9.client-requirements-closed"
    }
  ],
  "expectedStatus": "blocked",
  "from": "0.8.0",
  "to": "0.9.0"
}
