{
  "description": "A fix that matches no blocker is not applicable.",
  "document": "../../../0.8.0/examples/minimal.yaml",
  "expectedDiagnostics": [
    {
      "code": "conversion-fix-not-applicable",
      "path": [
        "info",
        "name"
      ],
      "rule": "mcpdesc.conversion.fix-applicable"
    }
  ],
  "expectedStatus": "blocked",
  "fixes": [
    {
      "fix": "remove-property",
      "path": [
        "info",
        "name"
      ]
    }
  ],
  "from": "0.8.0",
  "to": "0.9.0"
}
