{
  "description": "Removing the unknown annotation properties on request converts the document.",
  "document": "../../../0.8.0/fixtures/expected-valid/distinct-tool-and-resource-annotations.json",
  "expectedPatch": [
    {
      "op": "replace",
      "path": "/mcpdesc",
      "value": "0.9.0"
    },
    {
      "op": "replace",
      "path": "/$schema",
      "value": "https://mcpdesc.org/schema/mcp-description/0.9.0-draft.2.json"
    },
    {
      "op": "remove",
      "path": "/tools/0/annotations/futureToolHint"
    },
    {
      "op": "remove",
      "path": "/resources/0/annotations/futureResourceHint"
    }
  ],
  "expectedStatus": "converted",
  "fixes": [
    {
      "fix": "remove-property",
      "path": [
        "tools",
        0,
        "annotations",
        "futureToolHint"
      ]
    },
    {
      "fix": "remove-property",
      "path": [
        "resources",
        0,
        "annotations",
        "futureResourceHint"
      ]
    }
  ],
  "from": "0.8.0",
  "to": "0.9.0"
}
