{
  "description": "A fractional Resource size and example ttlMs block conversion; rounding is never automatic.",
  "document": "documents/fractional-numbers.json",
  "expectedDiagnostics": [
    {
      "code": "conversion-blocked",
      "path": [
        "resources",
        0,
        "size"
      ],
      "rule": "mcpdesc.conversion.0-8-to-0-9.integer-numbers"
    },
    {
      "code": "conversion-blocked",
      "path": [
        "resources",
        0,
        "examples",
        "cached",
        "result",
        "ttlMs"
      ],
      "rule": "mcpdesc.conversion.0-8-to-0-9.integer-numbers"
    }
  ],
  "expectedStatus": "blocked",
  "from": "0.8.0",
  "to": "0.9.0"
}
